Column1;class;word;sentence1;sentence2
0;1;polica; sort spet pridobiva ugled in se ponovno vrača na prodajne  police  cvetličarn. To rastlinsko vrsto uvrščamo v družino ustnatic,  ; kamiličnega čaja po nevihti. Biotrgovina, studio zdravja,  police  z naravno kozmetiko in lepa plesna dvorana, kjer se  
1;0;polica; v Ljubljani na Šmartinski cesti. Knjige, zložene na  policah  in položene po 14 mizah, se spogledujejo z 250  ; si svoje stene, bodisi poševne bodisi ravne. S  policami  je vse mogoče. 
2;1;polica;" za novo PE Slov. Konjice, skrb za urejenost prodajnih  polic , svetovanje strankam; vloge na naslov: Engrotuš d. ";" cvičkom, do dokončne odločitve sodišča še obdržijo na prodajnih  policah  in tako še naprej zavajajo kupce."" "
3;0;polica; Cerovo Cikava Čušperk Dobje Dole pri Polici Dolenja vas pri  Polici  Gabrje pri Ilovi Gori Gajniče Gatina Gorenja vas pri Polici  ; pa iz knjig, ki so jih izbrskali na zadnji  polici  knjižnice vedo za pričevanja po vojni maltretiranih in redkih,  
4;0;polica; (zeliščne tablete), ki so na voljo na  policah  bolje založenih lekarn ; zvezdicami z biserčki. To je imeniten okras za okensko  polico  ali starinsko komodo.  
5;1;polica; najnevarnejše spletne strani na svetu”. Danes na prodajne  police  v več deset državah prihaja njegova knjiga z naslovom Znotraj  ; to edina knjiga slovenskega avtorja, ki jo najdejo na  policah  skoraj vseh knjigarn Evrope! 
6;0;polica; filma Vojna zvezd, ki pa je na naših prodajnih  policah  še ni. ; dodatno k eni izmed veljavnih oblik zavarovanj, kar za  polico  življenjskega zavarovanja velja tudi v Volksbank in Hypo Alpe- 
7;1;polica; sveži kruh, žemlje in drugo pecivo že na prodajni  polici . ; ali ne. Ob nakupu ga je prodajalec vzel s  police , jaz ga nisem pregledal, ker sem prodajalcu zaupal 
8;1;polica; gibljejo med lončki različnih velikosti s skuto, razvrščenimi na  polici . Roka seže naprej in zagrabi največjega.  ; . Izredno uporabni so tudi zaradi tega, ker lahko  police  poljubno premikamo (višje ali nižje glede na potrebe)  
9;0;polica; Obiskovalka diskoteke Alcatraz je v nedeljo ponoči odložila torbico na  polico  pri točilnem pultu, trenutek nepazljivosti pa je izkoristil predrzni  ; Zaradi smrtonosnega kikirikija doslej največja čistka  polic  v ZDA 
10;0;polica; 3 Zgornja  polica  800 x 250 x 18 ; primerjavi s tistim, kar je bilo mogoče obdržati namesto  police , še zmeraj odličen. Moralno celo preveč odličen.  
11;0;polica; se nikar ne lotimo prezgodaj, ko so na Veliki  Polici  in v ozebniku še snežišča. Tudi z brezhibno opremo  ; tudi letos ponudili trgu mlado vino portugalko. Na prodajnih  policah  trgovin se bo pojavila že konec tega meseca. 
12;0;polica; funkcij ter z večpredstavnimi dodatki. Eden prvih na naših  policah  je Pavilion dv6, model 1350em, črno kromiran prenosnik ; tako zahtevnega kupca. Preglednost in jasno označene cene na  policah  in artiklih pa so že druga zgodba. 
13;0;polica; Jan Modic iz Dolenjega jezera in Andrej Lekšan z Bloške  police  skupaj s svojim voditeljem Marjanom Vadnujem in tehničnim pomočnikom Borisom  ; slike površja Marsa. Horsemen 3D lahko pričakujemo na prodajnih  policah  že letošnje poletje. 
14;1;polica; ki je danes za delodajalca vreden manj kot blago na  polici , bolj cenjen. Zato si v pogajanjih za kolektivno  ;" sobi; sončnik, kavč, likalna miza in na  policah  nenavadni predmeti, na steni slika iz metuljev; ženska "
15;0;polica; odsekanih kamnov mogoče opaziti na zahodnem robu Udinboršta vse do  Police , do Pečic na Pivki, kar dokazuje, da  ; IZRABA  POLIC  
16;1;polica; .« Zato po njegovem mnenju k višjim cenam na  policah  izdatno pripomorejo tudi trgovci z visokimi maržami, ki da  ; ko je trgovina zgrajena in opremljena, ko je na  policah  blago, postane celota nevidna (ali nepomembna) zaradi  
17;0;polica; , Svetino... S pomočjo pručke sem dosegel  polico , kjer je na spoštljivem mestu stala knjiga Muharjenje s  ; je iz Bosne prinesel Ervin Hladnik-Milharčič. Na  polici  nad mojo delovno mizo namreč stoji konzerva govedine, ki  
18;0;polica; čim bolje izrabite prostor. Nad vrata na primer pritrdite  police . Mesta nerodnih oblik, kot je niša pod umivalnikom ; z njihovo ponudbo in se pogajajte. Preverite tudi zavarovalne  police , ki ste jih že v preteklosti sklenili za več  
19;0;polica; snovalci pa so pozabili tudi na več odlagalnih predalov in  polic  ter na merilnik zunanje temperature. ; revne družine in jim naskrivaj pred njihova vrata ali okenske  police  polagal majhne darove. Predvsem so bila to jabolka,  
20;0;polica;" Cartesia je knjižna  polica , ki ima ""moč"", da vas prestavi  "; je lahko za domače trgovce to, da imajo na  policah  izdelke domačih proizvajalcev, ki jih tudi promovirajo, eden  
21;0;polica; naprej je stal v pekariji, se slinil in praznil  police , ob tem je pa ves čas z očmi slačil  ; stenama Struga in Vevnice. Iz grape na sprva široko  polico  – gredino v Strugu, ki pa se nato zoži 
22;0;polica; z okrasjem na stožcu. Tega lahko postavimo na okensko  polico  ; PRAPROTNA  POLICA  Znova je splet okoliščin zrežiral dramo, ki se je  
23;0;polica; Dela , in sicer tako, da bi s trgovskih  polic  umaknil izdelke Pivovarne Laško, kar pa Janković zanika. ; pod luknjo. Čez previs, nato proti desni po  polici  do izrazitega kota, ki se dviga rahlo proti desni 
24;1;polica; dan privoščite pohajkovanje po knjigarnah in prelistate knjige na knjižnih  policah , preglejte cene in morda za darila v prihodnje podarjajte  ; Poznavalce in uporabnike ponudbe Vögele poleg dobro založenih prodajnih  polic  navdušujejo še samopostrežna izbira, zmerne cene, tedenske pošiljke  
25;1;polica; peko kruha, v steklenih kredencah in z vrbo pletenih  policah  so razstavljeni različno oblikovani izdelki iz kvašenega, nekvašenega in  ; omehčane z zaobljenimi robovi, kar omogoča, da na  police  zložimo predmete vseh mogočih velikosti. Oblikovanje G. Carollo,  
26;1;polica; zaprta, poleg drugih steklenic dragih viskijev, na najvišji  polici , zadaj za točilnico. Vsak ponedeljek in četrtek sem  ; količina izdelkov na njih pa z višino stolpca na posamezni  polici . Iz barve stolpca pa lahko izvemo ostale podatke,  
27;0;polica; obogatili svojo ponudbo v prihodnje. Debitel bo na svoje  police  postavil samsunga i5700 galaxy spicea, opremljenega z operacijskim sistemom  ; oni poskrbeli za obnovo sedanje ceste od semaforskega križišča na  Polici  do tovarne Exoterm,« je pojasnil načrte Ivan Štular 
28;0;polica; mleko v prahu zdravstveno oporečno, je bilo umaknjeno s  polic . Ko pa so rezultati pokazali, da je bil  ; za poškodbe, ki jih dobi voznik povzročitelj nesreče.  Polica  krije iste poškodbe – škodo –, kot jih za  
29;1;polica; in ob slovenskem morju. Nastajajoča zgoščenka bo na prodajnih  policah  nova po daljšem obdobju, zato želi biti Nace,  ; naslovnica sta že narejena, knjiga pa bo na prodajne  police  prišla marca, ko se pisateljica vrne iz Tajske.  
30;1;polica; To njegovo že enaintrideseto zgodovinsko delo je prišlo na knjižne  police  prav na njegov 75. rojstni dan. Avtor pa pripravlja  ; Novem Mestu. Naš oddelek je skoraj opustošen: na  policah  na primer ni niti ene od več kot šestdesetih knjig  
31;0;polica; lani v shrambi pozabljenega kozjega sira. Po tleh in  policah  se bodo nemoteno nabirale cele Sahare prahu. Kuhinja bo  ; Gorenja vas. Teren 2: Šmarje- Sap-  Polica  (Grosuplje). 1.8.-5.9.1949. 
32;1;polica; ravno-znalec, ki v poplavi fantazijskih bukev na  polici  prave ali spletne knjigarne srečoma naleti na sprva nesumljivo povest  ;" dokaj ugodne. ""Vendar bi morala biti tudi na  policah  trgovin že na prvi pogled opazna razlika med kvaliteto medu "
33;0;polica; Najemodajalec vam mora pokazati zavarovalno  polico  avtodoma, ki mora biti po zahtevah zavarovalnic zavarovano z  ; opis: Mlin, Huda  Polica  6, pri Puciharju. Lastnik Ignac Zajec. 
34;0;polica;" . Ville spatiale pa bi lahko primerjali s ""prozorno  polico "", na kateri so naložene ""škatle"".  "; Nemec je v skupni kopalnici na  polico  odložil osebne stvari in brezskrbno odšel na stranišče, tat  
35;0;polica; precej, pa obstaja možnost za rešitev. Splošni pogoji  police  PPS namreč dopuščajo možnost, da če se ob pridobitvi  ; v muzej, se oglasim v vinoteki, kjer se  police  šibijo pod steklenicami s kar pisanimi etiketami. Na njih  
36;0;polica; svetovna vojna, se mi prikaže najprej podoba dolgih vrst  polic , na njih pa v lepem redu in z listi  ; bo omilil otekline na obrazu, lonček paradižnikov na okenski  polici  pa bo odgnal mrčes 
37;0;polica; Kožuh Novakova. V pooblastilo morate napisati še številko zavarovalne  police . Če je ne poznate, vam jo bodo povedali  ; ki sta jih potnika skrila v strop avtobusa in nad  police  za prtljago, v drugem pa je 9200 cigaret tihotapil  
38;0;polica; Za nove knjige zmanjkuje  polic  ;  Police  so skoraj prazne 
39;0;polica; bila Nina medtem, ko je Evans čakal na okenski  polici ? (Foto: Olycom) ;" : odpiranje od zunaj; osvetljen; prekrit s trdo  polico ; osnovna prostornina: 380 litrov; možnost povečanja z  "
40;0;polica; ki nas povede desno okrog jugozahodne strani Malega Ozebnika.  Polica  nas pripelje v strmo grapo, po kateri dosežemo ostro  ; in DAT trakovi. Na sredini sobe še in še  polic  z opremo. Sedem ali osem različnih klaviatur, nekaj  
41;0;polica; Za bogato cvetoče rastlinje na balkonih in okenskih  policah  se moramo dobro pripraviti že na nakup sadik, sajenje  ; Na  Polici  pri Naklem bo predvidoma stal center za mehansko biološko obdelavo  
42;0;polica; avtomobilskih zavarovanj. Sistem je zato javil, da te  police  ni v registru. S postopkom lahko nadaljujete. ; ki pravi: Dovoljeno za zaposlene. Sprehajam se med  policami  in pridem do čitalnice. Opazujem uporabnike, ki sedijo  
43;0;polica; znamenju naravnih odtenkov in bleščečih barv… Kmalu na prodajnih  policah . ; Trije glasbeniki, člani The  Police , niso nikoli uradno razglasili razpada skupine, vendar so  
44;0;polica; kot prostori njenih kolegov: pisalna miza, računalnik in  police , polne znanstvenih publikacij. Toda ta drobna dama se  ; za kmetijstvo, tri milijone za ureditev vaškega jedra na  Polici  in milijon za izdelavo projektne dokumentacije za prizidek k vrtcu  
45;0;polica; Knjižne  police  krasijo zakladi, ki jih je Jožica prinesla s svojih  ; , ki je znova premagala vse tekmice in na svoje  police  pospravila še en pokal za prvo mesto. (J.  
46;0;polica; za turnejo, s katero se na oder vrača skupina  Police , izginjajo s svetlobno hitrostjo. Zasedba je podrobnosti turneje  ; Za potrebe tega članka sem kar nekaj ur preživela pred  polico  z muesliji, koruznimi kosmiči in drugimi novejšimi žitaricami za  
47;1;polica; bohinjski sir, ki je pred časom izginil s prodajnih  polic .  ; se je začela že leta 2009, ko so s  polic  umaknili 100 W žarnice z žarilno nitko, letos septembra  
48;0;polica; da je tudi to novodobna umetnost, da imaš na  polici  akvarij (bučka) z mrtvo zlato ribo, ki  ; knjižna  polica  
49;0;polica; V Sparu, kjer imajo na  policah  okoli 70 odstotkov slovenskih izdelkov, menijo, da je  ; skalno pečino, opremljeno z udobno kraljevsko posteljo. Na  polici  mehko vezana izdaja Bridget Jones, nekaj školjk, dišeča  
